{
  "schema": "harness.evidence.v1",
  "evidence_id": "ev-SIGNOFF-002-focused-state",
  "run_id": "RUN-20260810-014",
  "task_id": "SIGNOFF-002",
  "source_sha": "a1b9c02000000000000000000000000000000000",
  "base_sha_or_release_candidate": "4d6662ef0bb1f52ba40dc670830ff95e52ca1cbf",
  "claim_ids": [
    "SIGNOFF-SHA-BOUND",
    "SIGNOFF-PACKET-BOUND"
  ],
  "proof_tier": "T2",
  "command_or_workflow": "cargo test -p harness-orchestrator --lib",
  "toolchain_and_lock": "Rust 1.97.1; Cargo.lock sha256:example",
  "target_and_profile": "x86_64-unknown-linux-gnu; focused local state test",
  "runner_or_device_identity": "local-runner",
  "fixture_or_dataset_digest": null,
  "started_at": "2026-08-10T22:38:00Z",
  "completed_at": "2026-08-10T22:41:18Z",
  "result_class": "success",
  "artifacts": [
    {
      "path": "artifacts/command/SIGNOFF-002-cargo-test.log.zst",
      "sha256": "2222222222222222222222222222222222222222222222222222222222222222",
      "media_type": "text/plain+zstd",
      "bytes": 18442
    }
  ],
  "unproved_claims": [
    "Hosted CI behavior was not exercised.",
    "Physical-device acceptance remains pending."
  ],
  "invalidated_by": null
}
