{
  "schema": "harness.evidence.v1",
  "evidence_id": "ev-MEDIA-002-focused-contract",
  "run_id": "NM-20260805-014",
  "task_id": "MEDIA-002",
  "source_sha": "a1b9c02000000000000000000000000000000000",
  "base_sha_or_release_candidate": "4d6662ef0bb1f52ba40dc670830ff95e52ca1cbf",
  "claim_ids": [
    "MEDIA-IDENTITY-EXPLICIT-EXACT",
    "MEDIA-IDENTITY-MALFORMED-REJECT"
  ],
  "proof_tier": "T2",
  "command_or_workflow": "cargo test -p c2-api event_media_contract",
  "toolchain_and_lock": "Rust 1.92; central/rust-c2/Cargo.lock sha256:example",
  "target_and_profile": "x86_64-unknown-linux-gnu; focused local component test",
  "runner_or_device_identity": "local-9950x",
  "fixture_or_dataset_digest": null,
  "started_at": "2026-08-05T22:38:00Z",
  "completed_at": "2026-08-05T22:41:18Z",
  "result_class": "success",
  "artifacts": [
    {
      "path": "artifacts/command/MEDIA-002-cargo-test.log.zst",
      "sha256": "2222222222222222222222222222222222222222222222222222222222222222",
      "media_type": "text/plain+zstd",
      "bytes": 18442
    }
  ],
  "unproved_claims": [
    "Live camera/fleet behavior was not exercised.",
    "Integrated producer/consumer parity remains pending."
  ],
  "invalidated_by": null
}
